{"format":"kane-fabric-administrative-descriptor","format_version":1,"descriptor_id":"us.il.condominium.finance","descriptor_version":1,"title":"Illinois Condominium — Budget, Assessments & Reserves","help":"Statewide Illinois condominium fiscal infrastructure. Statutory duties and timing rules are Infrastructure; fiscal-year values, adopted amounts, schedules, reserve balances, and supporting records are association-instance data.","scope":{"country_code":"US","state_code":"IL","label":"Illinois statewide condominium infrastructure","applies_to":"condominium_association","admission_rule":"Statewide Illinois applicability is required. County-specific, municipal, association-customary, future-effective, or uncertain requirements are deferred until separately modeled."},"categories":[{"id":"finance.budget","label":"Annual budget"},{"id":"finance.assessments","label":"Assessments"},{"id":"finance.reserves","label":"Reserves"},{"id":"finance.accounting","label":"Financial accounting"}],"authorities":[{"id":"il-condo-act-9","kind":"state_statute","citation":"765 ILCS 605/9","url":"https://www.ilga.gov/legislation/ilcs/fulltext?DocName=076506050K9","summary":"Sharing of expenses, annual budget, assessments, and reserve requirements."},{"id":"il-condo-act-18","kind":"state_statute","citation":"765 ILCS 605/18(a)(6)-(8), 18(i)","url":"https://www.ilga.gov/legislation/ilcs/fulltext?DocName=076506050K18","summary":"Budget delivery, annual accounting, assessment procedures, and unit-owner account statements."},{"id":"il-condo-act-18-4","kind":"state_statute","citation":"765 ILCS 605/18.4(b)-(d), (i), (k)","url":"https://www.ilga.gov/legislation/ilcs/fulltext?DocName=076506050K18.4","summary":"Board duties to budget, levy and collect assessments, keep detailed financial records, and pay authorized real-property taxes and charges."}],"pages":[{"id":"finance","title":"Budget, Assessments & Reserves","help":"The descriptor separates statewide fiscal rules from the association-specific values and records that instantiate them.","sections":[{"id":"statewide-fiscal-framework","title":"Statewide fiscal framework","help":"These are statewide Illinois condominium rules, not editable association assertions.","authority_refs":["il-condo-act-9","il-condo-act-18","il-condo-act-18-4"],"layout":{"columns":12},"controls":[{"id":"annual-budget-duty","kind":"notice","text":"The board must prepare and distribute a detailed proposed annual budget identifying anticipated common expenses by category, anticipated assessments, other income, and each unit owner's proposed common-expense assessment.","authority_refs":["il-condo-act-9"],"data_role":"infrastructure","layout":{"row":1,"column":1,"span":6}},{"id":"budget-advance-copy","kind":"notice","text":"Each unit owner must receive a copy of the proposed annual budget at least 25 days before board adoption, including an indication of portions intended for reserves, capital expenditures or repairs, or payment of real estate taxes.","authority_refs":["il-condo-act-18"],"data_role":"infrastructure","layout":{"row":1,"column":7,"span":6}},{"id":"annual-accounting-duty","kind":"notice","text":"The board must annually supply unit owners an itemized accounting of the preceding year's common expenses actually incurred or paid, identifying reserves, capital expenditures or repairs, real estate taxes, amounts collected under the budget or assessments, and the net excess or deficit of income over expenditures plus reserves.","authority_refs":["il-condo-act-18"],"data_role":"infrastructure","layout":{"row":2,"column":1,"span":6}},{"id":"board-financial-duties","kind":"notice","text":"The board's statewide duties include preparing, adopting and distributing the annual budget; levying and expending assessments; collecting assessments; and keeping detailed, accurate records of receipts and expenditures affecting operation of the property.","authority_refs":["il-condo-act-18-4"],"data_role":"infrastructure","layout":{"row":2,"column":7,"span":6}},{"id":"common-expense-share","kind":"notice","text":"Each unit owner must pay the proportionate share of common expenses in the same ratio as the unit's percentage of ownership in the common elements set forth in the declaration, subject to statutory and condominium-instrument provisions.","authority_refs":["il-condo-act-9"],"data_role":"infrastructure","layout":{"row":3,"column":1,"span":6}},{"id":"reasonable-reserves","kind":"notice","text":"Annual budgets must provide reasonable reserves for capital expenditures and deferred maintenance for repair or replacement of common elements, subject to the statutory reserve-waiver mechanism.","authority_refs":["il-condo-act-9"],"data_role":"infrastructure","layout":{"row":3,"column":7,"span":6}},{"id":"reserve-waiver-rule","kind":"notice","text":"If the condominium instruments do not themselves require reserves, the association may waive all or part of the statutory reserve requirement by a two-thirds vote of the total association votes; a waiver must be disclosed as required by statute.","authority_refs":["il-condo-act-9"],"data_role":"infrastructure","layout":{"row":4,"column":1,"span":12}}]},{"id":"fiscal-year-instance","title":"Fiscal-year administration","help":"Association-specific dates and retained fiscal records for the current budget cycle.","authority_refs":["il-condo-act-9","il-condo-act-18"],"layout":{"columns":12},"controls":[{"id":"fiscal-year-start","kind":"date","label":"Fiscal year start","binding":"association.finance.fiscal_year.start","data_role":"association_instance","layout":{"row":1,"column":1,"span":3}},{"id":"fiscal-year-end","kind":"date","label":"Fiscal year end","binding":"association.finance.fiscal_year.end","data_role":"association_instance","layout":{"row":1,"column":4,"span":3}},{"id":"proposed-budget-delivery-date","kind":"date","label":"Proposed budget delivered","binding":"association.finance.fiscal_year.proposed_budget_delivered","help":"Date the proposed annual budget was supplied to unit owners.","authority_refs":["il-condo-act-18"],"data_role":"association_instance","layout":{"row":1,"column":7,"span":3}},{"id":"budget-adoption-date","kind":"date","label":"Budget adopted","binding":"association.finance.fiscal_year.budget_adopted","data_role":"association_instance","layout":{"row":1,"column":10,"span":3}},{"id":"annual-accounting-delivery-date","kind":"date","label":"Annual accounting supplied","binding":"association.finance.fiscal_year.annual_accounting_supplied","data_role":"association_instance","layout":{"row":2,"column":1,"span":3}},{"id":"budget-document-reference","kind":"textarea","label":"Budget document reference","binding":"association.finance.fiscal_year.budget_document_reference","rows":2,"help":"Reference or locator for the proposed/adopted budget retained by the association.","data_role":"association_instance","layout":{"row":2,"column":4,"span":4}},{"id":"annual-accounting-reference","kind":"textarea","label":"Annual accounting reference","binding":"association.finance.fiscal_year.annual_accounting_reference","rows":2,"help":"Reference or locator for the annual itemized accounting supplied to unit owners.","data_role":"association_instance","layout":{"row":2,"column":8,"span":5}}]},{"id":"annual-budget-summary","title":"Annual budget summary","help":"Current fiscal-year totals and detailed line items. Monetary units and presentation format are descriptor metadata.","authority_refs":["il-condo-act-9","il-condo-act-18"],"layout":{"columns":12},"controls":[{"id":"anticipated-common-expenses","kind":"number","label":"Anticipated common expenses","binding":"association.finance.budget.anticipated_common_expenses","min":0,"step":0.01,"unit":"USD","format":"currency","data_role":"association_instance","layout":{"row":1,"column":1,"span":3}},{"id":"anticipated-assessments","kind":"number","label":"Anticipated assessments","binding":"association.finance.budget.anticipated_assessments","min":0,"step":0.01,"unit":"USD","format":"currency","data_role":"association_instance","layout":{"row":1,"column":4,"span":3}},{"id":"anticipated-other-income","kind":"number","label":"Anticipated other income","binding":"association.finance.budget.anticipated_other_income","min":0,"step":0.01,"unit":"USD","format":"currency","data_role":"association_instance","layout":{"row":1,"column":7,"span":3}},{"id":"planned-reserve-contribution","kind":"number","label":"Planned reserve contribution","binding":"association.finance.budget.planned_reserve_contribution","min":0,"step":0.01,"unit":"USD","format":"currency","data_role":"association_instance","layout":{"row":1,"column":10,"span":3}},{"id":"planned-capital-expenditures","kind":"number","label":"Capital expenditures","binding":"association.finance.budget.capital_expenditures","min":0,"step":0.01,"unit":"USD","format":"currency","data_role":"association_instance","layout":{"row":2,"column":1,"span":3}},{"id":"planned-repairs","kind":"number","label":"Repairs","binding":"association.finance.budget.repairs","min":0,"step":0.01,"unit":"USD","format":"currency","data_role":"association_instance","layout":{"row":2,"column":4,"span":3}},{"id":"planned-real-estate-taxes","kind":"number","label":"Real estate taxes","binding":"association.finance.budget.real_estate_taxes","min":0,"step":0.01,"unit":"USD","format":"currency","data_role":"association_instance","layout":{"row":2,"column":7,"span":3}},{"id":"budget-line-items","kind":"collection","label":"Budget line items","binding":"association.finance.budget.line_items","help":"Detailed budget categories and amounts. Add enough items to reproduce the association's adopted budget structure.","authority_refs":["il-condo-act-9"],"data_role":"association_instance","min_items":1,"item_label":"Budget line","actions":{"add_label":"Add budget line","remove_label":"Remove budget line"},"item_layout":{"columns":12},"layout":{"row":3,"column":1,"span":12},"item_controls":[{"id":"budget-line-label","kind":"text","label":"Ca